{
  "Source_ID": "SRC-000001",
  "Title": "(يُملأ من استجابة Crossref حرفياً)",
  "Author": ["(من استجابة الأداة)"],
  "Year": 2020,
  "Publisher": null,
  "Journal": null,
  "Volume": null,
  "Issue": null,
  "Pages": null,
  "DOI": "10.0000/example-only",
  "URL": null,
  "Date_Accessed": "2026-10-07",
  "Source_Type": "peer_reviewed_journal",
  "Tier": 1,
  "Peer_Reviewed": true,
  "Verification_Status": "VERIFIED",
  "Verification_Evidence": {"tool": "TL-CROSSREF", "checked_at": "2026-10-07T10:00:00+00:00", "match_score": 0.97, "response_ref": "https://api.crossref.org/works/10.0000/example-only"},
  "Used_In": ["RKP-2026-0001:ch01"],
  "Reliability_Level": "HIGH",
  "Zotero_Key": null,
  "OpenAlex_ID": null,
  "Notes": "مثال بنيوي فقط — DOI وهمي صريح لتوضيح الحقول؛ لا يُستشهد به."
}
